{
  "version": "1.0",
  "self": "https://apps-json.org/apps.json",
  "updated": "2026-05-08T00:00:00-04:00",
  "author": {
    "name": "apps.json",
    "url": "https://apps-json.org",
    "social": [
      {
        "platform": "github",
        "url": "https://github.com/itsbdell/apps-json",
        "handle": "itsbdell/apps-json"
      }
    ]
  },
  "apps": [
    {
      "id": "apps-json-standard",
      "name": "apps.json Standard",
      "description": "A small JSON file format for publishing the apps a person or organization makes.",
      "url": "https://apps-json.org",
      "updated": "2026-05-08T00:00:00-04:00",
      "tags": ["standard", "feed", "open-web"],
      "source": "https://github.com/itsbdell/apps-json",
      "forkable": true,
      "targets": [
        {
          "kind": "web",
          "url": "https://apps-json.org",
          "label": "Home"
        },
        {
          "kind": "web",
          "url": "https://github.com/itsbdell/apps-json/blob/main/spec/SPEC.md",
          "label": "Spec"
        },
        {
          "kind": "web",
          "url": "https://github.com/itsbdell/apps-json/blob/main/spec/apps.schema.json",
          "label": "JSON Schema"
        }
      ]
    },
    {
      "id": "appfeed-cli",
      "name": "appfeed CLI",
      "description": "Reference CLI for validating and maintaining apps.json feeds.",
      "url": "https://www.npmjs.com/package/@apps-json/cli",
      "updated": "2026-05-08T00:00:00-04:00",
      "tags": ["cli", "validator", "publishing"],
      "source": "https://github.com/itsbdell/apps-json/tree/main/appfeed",
      "forkable": true,
      "targets": [
        {
          "kind": "cli",
          "command": "npx @apps-json/cli validate <url-or-path>",
          "label": "Validate a feed"
        }
      ]
    },
    {
      "id": "apps-json-reader",
      "name": "apps.json Reader",
      "description": "Reference browser reader for rendering and validating an apps.json feed URL.",
      "url": "https://apps-json.org/?feed=https://yourdomain.com/apps.json",
      "updated": "2026-05-08T00:00:00-04:00",
      "tags": ["reader", "validator", "web"],
      "source": "https://github.com/itsbdell/apps-json/tree/main/site",
      "forkable": true,
      "targets": [
        {
          "kind": "web",
          "url": "https://apps-json.org/?feed=https://yourdomain.com/apps.json",
          "label": "Open reader"
        }
      ]
    },
    {
      "id": "apps-json-badge",
      "name": "apps.json Badge Generator",
      "description": "Paste-ready badge generator for linking a site or README to an apps.json feed.",
      "url": "https://apps-json.org/badge.html",
      "updated": "2026-05-08T00:00:00-04:00",
      "tags": ["badge", "publishing", "web"],
      "source": "https://github.com/itsbdell/apps-json/tree/main/site",
      "forkable": true,
      "targets": [
        {
          "kind": "web",
          "url": "https://apps-json.org/badge.html",
          "label": "Generate badge"
        }
      ]
    },
    {
      "id": "apps-json-digest",
      "name": "apps.json Digest",
      "description": "Example digest and subscription feeds generated from the seeded apps.json directory.",
      "url": "https://apps-json.org/digest.html",
      "updated": "2026-05-08T00:00:00-04:00",
      "tags": ["digest", "directory", "feed"],
      "source": "https://github.com/itsbdell/apps-json/tree/main/site",
      "forkable": true,
      "targets": [
        {
          "kind": "web",
          "url": "https://apps-json.org/digest.html",
          "label": "Open digest"
        },
        {
          "kind": "web",
          "url": "https://apps-json.org/feed.json",
          "label": "JSON Feed"
        },
        {
          "kind": "web",
          "url": "https://apps-json.org/feed.xml",
          "label": "RSS"
        }
      ]
    },
    {
      "id": "apps-json-agent-skills",
      "name": "apps.json Agent Skills",
      "description": "Agent-readable skills for bootstrapping and maintaining apps.json feeds.",
      "url": "https://github.com/itsbdell/apps-json-agent-skills",
      "updated": "2026-05-08T00:00:00-04:00",
      "tags": ["agent-skills", "publishing", "feeds"],
      "source": "https://github.com/itsbdell/apps-json-agent-skills",
      "forkable": true,
      "targets": [
        {
          "kind": "claude-plugin",
          "url": "https://github.com/itsbdell/apps-json-agent-skills",
          "label": "Claude Code plugin"
        },
        {
          "kind": "codex-plugin",
          "url": "https://github.com/itsbdell/apps-json-agent-skills",
          "label": "Codex plugin"
        },
        {
          "kind": "claude-skill",
          "url": "https://github.com/itsbdell/apps-json-agent-skills/tree/main/skills/apps-json-setup",
          "label": "Setup skill"
        },
        {
          "kind": "claude-skill",
          "url": "https://github.com/itsbdell/apps-json-agent-skills/tree/main/skills/apps-json-publisher",
          "label": "Publisher skill"
        }
      ]
    }
  ]
}
