{
  "version": "1.0",
  "self": "https://briandell.com/apps.json",
  "updated": "2026-04-30T12:00:00Z",
  "author": {
    "name": "Brian Dell",
    "url": "https://briandell.com",
    "social": [
      { "platform": "github", "url": "https://github.com/briandell", "handle": "briandell" },
      { "platform": "twitter", "url": "https://twitter.com/briandell", "handle": "@briandell" }
    ]
  },
  "apps": [
    {
      "id": "smaug",
      "name": "Smaug",
      "description": "Personal bookmarks vault with AI synthesis.",
      "url": "https://smaug.briandell.com",
      "version": "0.4.2",
      "updated": "2026-04-22T09:14:00Z",
      "tags": ["bookmarks", "vault", "ai"],
      "vibe_coded": true,
      "prompt_log": "https://briandell.com/smaug/prompts",
      "forkable": true,
      "source": "https://github.com/briandell/smaug",
      "targets": [
        { "kind": "web", "url": "https://smaug.briandell.com", "label": "Open in browser" },
        { "kind": "macos", "url": "https://briandell.com/smaug/Smaug.dmg", "label": "Install on Mac" }
      ]
    },
    {
      "id": "outreach",
      "name": "Outreach",
      "description": "Topic-driven networking pipeline as a Claude skill.",
      "url": "https://briandell.com/skills/outreach",
      "vibe_coded": true,
      "targets": [
        {
          "kind": "claude-skill",
          "url": "https://briandell.com/skills/outreach.zip",
          "label": "Install in Claude Code"
        }
      ]
    },
    {
      "id": "phrase-chain-fork",
      "name": "Phrase Chain — Spanish edition",
      "description": "Fork of phrase-chain retrained on Spanish corpora.",
      "url": "https://briandell.com/phrase-chain-es",
      "vibe_coded": true,
      "forkable": true,
      "replaces": "app://someone-else.com/phrase-chain"
    }
  ]
}
